<?xml version="1.0" encoding="UTF-8"?>
<!-- edited with XMLSpy v2014 rel. 2 (x64) (http://www.altova.com) by Elaine Matthews (Banctec Limited) -->
<xs:schema xmlns:xs="http://www.w3.org/2001/XMLSchema" xmlns:vc="http://www.w3.org/2007/XMLSchema-versioning" elementFormDefault="qualified" attributeFormDefault="unqualified" vc:minVersion="1.1">
    <xs:element name="LPC">
        <xs:annotation>
            <xs:documentation>Continuation sheets</xs:documentation>
        </xs:annotation>
        <xs:complexType>
            <xs:sequence>
                <xs:element name="Page1" minOccurs="0" maxOccurs="unbounded">
                    <xs:complexType>
                        <xs:sequence>
                            <xs:element name="ContinuationSheet1">
                                <xs:annotation>
                                    <xs:documentation>AdditionalPeople</xs:documentation>
                                </xs:annotation>
                                <xs:complexType>
                                    <xs:sequence>
                                        <xs:element name="Attorney" minOccurs="2" maxOccurs="2">
                                            <xs:complexType>
                                                <xs:sequence>
                                                    <xs:element name="Attorney" type="xs:boolean"/>
                                                    <xs:element name="ReplacementAttorney" type="xs:boolean"/>
                                                    <xs:element name="PersonToNotify" type="xs:boolean"/>
                                                    <xs:element name="Title" type="xs:string"/>
                                                    <xs:element ref="FirstName"/>
                                                    <xs:element ref="LastName"/>
                                                    <xs:element ref="DOB"/>
                                                    <xs:element ref="Address"/>
                                                    <xs:element ref="Email"/>
                                                </xs:sequence>
                                            </xs:complexType>
                                        </xs:element>
                                        <xs:element name="Donor">
                                            <xs:complexType>
                                                <xs:sequence>
                                                    <xs:element ref="FullName"/>
                                                    <xs:element ref="Signature"/>
                                                    <xs:element ref="Date"/>
                                                </xs:sequence>
                                            </xs:complexType>
                                        </xs:element>
                                    </xs:sequence>
                                </xs:complexType>
                            </xs:element>
                            <xs:element ref="BURN"/>
                            <xs:element ref="PhysicalPage"/>
                        </xs:sequence>
                    </xs:complexType>
                </xs:element>
                <xs:element name="Page2" minOccurs="0" maxOccurs="unbounded">
                    <xs:complexType>
                        <xs:sequence>
                            <xs:element name="ContinuationSheet2">
                                <xs:annotation>
                                    <xs:documentation>Additional Information</xs:documentation>
                                </xs:annotation>
                                <xs:complexType>
                                    <xs:sequence>
                                        <xs:element name="AdditionalInformation">
                                            <xs:complexType>
                                                <xs:sequence>
                                                    <xs:element name="Notes" type="xs:boolean"/>
                                                    <xs:element name="Instructions" type="xs:boolean"/>
                                                    <xs:element name="Preferences" type="xs:boolean"/>
                                                    <xs:element name="ReplacementAttorneys" type="xs:boolean"/>
                                                    <xs:element name="Jointly" type="xs:boolean"/>
                                                </xs:sequence>
                                            </xs:complexType>
                                        </xs:element>
                                        <xs:element name="Donor">
                                            <xs:complexType>
                                                <xs:sequence>
                                                    <xs:element ref="FullName"/>
                                                    <xs:element ref="Signature"/>
                                                    <xs:element ref="Date"/>
                                                </xs:sequence>
                                            </xs:complexType>
                                        </xs:element>
                                    </xs:sequence>
                                </xs:complexType>
                            </xs:element>
                            <xs:element ref="BURN"/>
                            <xs:element ref="PhysicalPage"/>
                        </xs:sequence>
                    </xs:complexType>
                </xs:element>
                <xs:element name="Page3" minOccurs="0" maxOccurs="unbounded">
                    <xs:complexType>
                        <xs:sequence>
                            <xs:element name="ContinuationSheet3">
                                <xs:annotation>
                                    <xs:documentation>If the donor cannot sign or mark</xs:documentation>
                                </xs:annotation>
                                <xs:complexType>
                                    <xs:sequence>
                                        <xs:element name="Donor">
                                            <xs:complexType>
                                                <xs:sequence>
                                                    <xs:element ref="FullName"/>
                                                </xs:sequence>
                                            </xs:complexType>
                                        </xs:element>
                                        <xs:element name="Signatory">
                                            <xs:complexType>
                                                <xs:sequence>
                                                    <xs:element ref="Signature"/>
                                                    <xs:element ref="FullName"/>
                                                    <xs:element ref="Date"/>
                                                </xs:sequence>
                                            </xs:complexType>
                                        </xs:element>
                                        <xs:element name="Witnesses" minOccurs="2" maxOccurs="2">
                                            <xs:complexType>
                                                <xs:sequence>
                                                    <xs:element ref="Signature"/>
                                                    <xs:element ref="FullName"/>
                                                    <xs:element ref="Address"/>
                                                </xs:sequence>
                                            </xs:complexType>
                                        </xs:element>
                                    </xs:sequence>
                                </xs:complexType>
                            </xs:element>
                            <xs:element ref="BURN"/>
                            <xs:element ref="PhysicalPage"/>
                        </xs:sequence>
                    </xs:complexType>
                </xs:element>
                <xs:element name="Page4" minOccurs="0" maxOccurs="unbounded">
                    <xs:complexType>
                        <xs:sequence>
                            <xs:element name="ContinuationSheet4">
                                <xs:annotation>
                                    <xs:documentation>Trust corporation appointed as an attorney</xs:documentation>
                                </xs:annotation>
                                <xs:complexType>
                                    <xs:sequence>
                                        <xs:element name="CompanyRegistration" type="xs:string"/>
                                        <xs:element name="AuthorisedPerson" minOccurs="2" maxOccurs="2">
                                            <xs:complexType>
                                                <xs:sequence>
                                                    <xs:element ref="Signature"/>
                                                    <xs:element ref="FullName"/>
                                                    <xs:element ref="Date"/>
                                                </xs:sequence>
                                            </xs:complexType>
                                        </xs:element>
                                    </xs:sequence>
                                </xs:complexType>
                            </xs:element>
                            <xs:element ref="BURN"/>
                            <xs:element ref="PhysicalPage"/>
                        </xs:sequence>
                    </xs:complexType>
                </xs:element>
            </xs:sequence>
        </xs:complexType>
    </xs:element>
    <xs:element name="Name">
        <xs:complexType>
            <xs:sequence>
                <xs:element ref="Salutation"/>
                <xs:element ref="LastName"/>
                <xs:element ref="FirstName"/>
                <xs:element name="MiddleName" type="xs:string" minOccurs="0"/>
            </xs:sequence>
        </xs:complexType>
    </xs:element>
    <xs:element name="Salutation">
        <xs:complexType>
            <xs:sequence>
                <xs:element name="Mr" type="xs:boolean"/>
                <xs:element name="Mrs" type="xs:boolean"/>
                <xs:element name="Ms" type="xs:boolean"/>
                <xs:element name="Miss" type="xs:boolean"/>
                <xs:element name="Other" type="xs:boolean" minOccurs="0"/>
                <xs:element name="OtherName" type="xs:string"/>
            </xs:sequence>
        </xs:complexType>
    </xs:element>
    <xs:element name="Address">
        <xs:complexType>
            <xs:sequence>
                <xs:element name="Address1" type="xs:string"/>
                <xs:element name="Address2" type="xs:string"/>
                <xs:element name="Address3" type="xs:string"/>
                <xs:element name="Postcode" type="xs:string"/>
            </xs:sequence>
        </xs:complexType>
    </xs:element>
    <xs:element name="Telephone" type="xs:string"/>
    <xs:element name="DOB" type="xs:string"/>
    <xs:element name="Email" type="xs:string"/>
    <xs:element name="Attorney"/>
    <xs:element name="DXDetails">
        <xs:complexType>
            <xs:sequence>
                <xs:element name="DXNumber" type="xs:string"/>
                <xs:element name="DXExchange" type="xs:string"/>
            </xs:sequence>
        </xs:complexType>
    </xs:element>
    <xs:element name="Relationship">
        <xs:complexType>
            <xs:sequence>
                <xs:element name="CivilPartnerSpouse" type="xs:boolean"/>
                <xs:element name="Child" type="xs:boolean"/>
                <xs:element name="Solicitor" type="xs:boolean"/>
                <xs:element name="Other" type="xs:boolean"/>
                <xs:element name="OtherProfessional" type="xs:boolean"/>
                <xs:element name="OtherName" type="xs:string">
                    <xs:annotation>
                        <xs:documentation>If other or other professional, please specify</xs:documentation>
                    </xs:annotation>
                </xs:element>
            </xs:sequence>
        </xs:complexType>
    </xs:element>
    <xs:element name="Notification">
        <xs:complexType>
            <xs:sequence>
                <xs:element name="NoticeDate" type="xs:string"/>
                <xs:element name="LastName" type="xs:string"/>
                <xs:element name="FirstName" type="xs:string"/>
                <xs:element ref="Address"/>
            </xs:sequence>
        </xs:complexType>
    </xs:element>
    <xs:element name="IorWe">
        <xs:complexType>
            <xs:sequence>
                <xs:element name="I" type="xs:boolean"/>
                <xs:element name="We" type="xs:boolean"/>
            </xs:sequence>
        </xs:complexType>
    </xs:element>
    <xs:element name="Date" type="xs:string"/>
    <xs:element name="YesorNo">
        <xs:complexType>
            <xs:sequence>
                <xs:element name="Yes" type="xs:boolean"/>
                <xs:element name="No" type="xs:boolean"/>
            </xs:sequence>
        </xs:complexType>
    </xs:element>
    <xs:element name="LastName" type="xs:string"/>
    <xs:element name="FirstName" type="xs:string"/>
    <xs:element name="Declaration">
        <xs:complexType>
            <xs:sequence>
                <xs:element name="Signed" type="xs:string"/>
                <xs:element ref="Date"/>
                <xs:element ref="LastName"/>
                <xs:element ref="FirstName"/>
            </xs:sequence>
        </xs:complexType>
    </xs:element>
    <xs:element name="CompanyName" type="xs:string"/>
    <xs:element name="Occupation" type="xs:string"/>
    <xs:element name="BURN" type="xs:string"/>
    <xs:element name="PhysicalPage" type="xs:int"/>
    <xs:element name="Signature" type="xs:boolean"/>
    <xs:element name="FullName" type="xs:string"/>
</xs:schema>
