<LPC xmlns:xsi="http://www.w3.org/2001/XMLSchema-instance"
     xsi:noNamespaceSchemaLocation="LPC.xsd">
    <Page1>
        <ContinuationSheet1>
            <Attorney>
                <Attorney>true</Attorney>
                <ReplacementAttorney>false</ReplacementAttorney>
                <PersonToNotify>false</PersonToNotify>
                <Title>Mr</Title>
                <FirstName>Jack</FirstName>
                <LastName>Jones</LastName>
                <DOB>1970-01-01</DOB>
                <Address>
                    <Address1>1 Example Road</Address1>
                    <Address2>Example Town</Address2>
                    <Address3>Example County</Address3>
                    <Postcode>EX4 MPL</Postcode>
                </Address>
                <Email>john.doe@example.com</Email>
            </Attorney>

            <Attorney>
                <Attorney>false</Attorney>
                <ReplacementAttorney>true</ReplacementAttorney>
                <PersonToNotify>false</PersonToNotify>
                <Title>Mrs</Title>
                <FirstName>Mary</FirstName>
                <LastName>Smith</LastName>
                <DOB>1975-05-05</DOB>
                <Address>
                    <Address1>2 Example Avenue</Address1>
                    <Address2>Example Town</Address2>
                    <Address3>Example County</Address3>
                    <Postcode>EX4 MPL</Postcode>
                </Address>
                <Email>mary.smith@example.com</Email>
            </Attorney>

            <Donor>
                <FullName>Jane Donor</FullName>
                <Signature>true</Signature>
                <Date>2025-01-29</Date>
            </Donor>
        </ContinuationSheet1>
        <BURN>Valid BURN text</BURN>
        <PhysicalPage>1</PhysicalPage>
    </Page1>

    <Page2>
        <ContinuationSheet2>
            <AdditionalInformation>
                <Notes>true</Notes>
                <Instructions>true</Instructions>
                <Preferences>true</Preferences>
                <ReplacementAttorneys>false</ReplacementAttorneys>
                <Jointly>false</Jointly>
            </AdditionalInformation>
            <Donor>
                <FullName>John Donor</FullName>
                <Signature>true</Signature>
                <Date>2025-01-29</Date>
            </Donor>
        </ContinuationSheet2>
        <BURN>Valid BURN text</BURN>
        <PhysicalPage>2</PhysicalPage>
    </Page2>

    <Page3>
        <ContinuationSheet3>
            <Donor>
                <FullName>John Donor</FullName>
            </Donor>

            <Signatory>
                <Signature>true</Signature>
                <FullName>James Signatory</FullName>
                <Date>2025-01-29</Date>
            </Signatory>

            <Witnesses>
                <Signature>true</Signature>
                <FullName>Witness 1</FullName>
                <Address>
                    <Address1>3 Example Road</Address1>
                    <Address2>Example Town</Address2>
                    <Address3></Address3>
                    <Postcode>EX4 MPL</Postcode>
                </Address>
            </Witnesses>

            <Witnesses>
                <Signature>true</Signature>
                <FullName>Witness 2</FullName>
                <Address>
                    <Address1>3 Example Road</Address1>
                    <Address2>Example Town</Address2>
                    <Address3></Address3>
                    <Postcode>EX4 MPL</Postcode>
                </Address>
            </Witnesses>
        </ContinuationSheet3>
        <BURN>Valid BURN text</BURN>
        <PhysicalPage>3</PhysicalPage>
    </Page3>

    <Page4>
        <ContinuationSheet4>
            <CompanyRegistration>Company12345</CompanyRegistration>

            <AuthorisedPerson>
                <Signature>true</Signature>
                <FullName>Authorized Person 1</FullName>
                <Date>2025-01-29</Date>
            </AuthorisedPerson>

            <AuthorisedPerson>
                <Signature>true</Signature>
                <FullName>Authorized Person 2</FullName>
                <Date>2025-01-29</Date>
            </AuthorisedPerson>
        </ContinuationSheet4>
        <BURN>Valid BURN text</BURN>
        <PhysicalPage>4</PhysicalPage>
    </Page4>
</LPC>
